"HBW75E5P","journalArticle","","","Heterogeneous large-scale group decision making with subgroup leaders: An application to the green supplier selection","","","","","","Under the mainstream development trend of energy conservation, environmental protection and sustainability, green supplier selection has become a common concern of many enterprises and scholars. Meanwhile, more and more attention has been paid to the problem of large-scale group decision making (LSGDM) which requires the participation of multiple decision makers (DMs). As the factors to be considered in selecting the optimal green supplier become increasingly complex, DMs with different professional backgrounds may give different forms of assessment. Therefore, it is of great significance to study the application of heterogeneous LSGDM in green supplier selection (GSS). In this article, a new heterogeneous LSGDM method based on subgroup leaders (SLs) is proposed. First, a novel determination method of SLs is presented based on the interaction between DMs. Then, according to the heterogeneous preference information of SLs, the solution method of the collective priority vector is given, and then an approach to determine the overall consensus level is presented by considering the consensus degree within and between subgroups. Subsequently, a consensus building method is proposed to manage the non-cooperative behaviour of DMs and reduce the divergences among DMs. Finally, an example of GSS is given to demonstrate the applicability and effectiveness of the proposed method.","","2026-01-27 18:56:21","2026-01-27 18:56:21","","","","","","","","","","","","","","","","","","","","","","","","","","","","","","","","","","","","","","","","","","","","","","","","","","","","","","","","","","","","","","","","","","","","","","","","",""
"AH25T66J","journalArticle","","","Two-stage consensus reaching process for matching based on the cloud model in large-scale sharing platform: a case study in the industrial internet platform","","","","","","The sharing economy plays an important role in economic development, and matching is the core point in the sharing economy. However, the large-scale sharing results in low efficiencies and weak matching. To address the problem, we design a two-stage consensus reaching process for resource sharing in the platform. Firstly, considering the time-consuming process of generating satisfaction, we design a new method to generate satisfaction based on large-scale mixed historical data. The cloud model is used to unify the mixed uncertain information. Then, we design a two-stage consensus reaching process to realize stable matching. For the first stage, we maximize the total consensus of the suppliers' and demanders' group. For the second stage, to realize stable sharing, we satisfy the individuals' requirement of consensus. The platform's strategies, such as discount and scheduling, are used to adjust their consensus. Finally, considering the two-stage consensus reaching process hierarchy, we establish bi-level programming to embody the features. An improved algorithm is designed to deal with bi-level programming. Also, an industrial internet platform is used as an example to verify the method and algorithm.","","2026-01-27 18:56:21","2026-01-27 18:56:21","","","","","","","","","","","","","","","","","","","","","","","","","","","","","","","","","","","","","","","","","","","","","","","","","","","","","","","","","","","","","","","","","","","","","","","","",""
"AUUVBMQ2","journalArticle","","","A Group Consensus Model for Multiple Attributes Group Decision Making with Interval Belief Distribution and Interval Distributed Preference Relation","","","","","","In multiple attributes group decision making (MAGDM), how to generate a consensus-based solution that is satisfactory to most of decision makers, is always a critical research issue. This paper proposes a group consensus model for MAGDM based on interval belief distribution (IBD) and interval distributed preference relation (IDPR). The transformation function from IBD to IDPR is first designed to unify IBD and IDPR. Two principles are presented to guarantee the satisfaction of internal consistency before and after the transformation. Based on the unification of IBD and IDPR, a consensus reaching process is developed. In the process, the group consensus at the attribute, alternative and global levels based on IDPRs is first measured, and a feedback mechanism consisting of identification rules and suggestion rules is then designed to help accelerate the convergence of group consensus. With the developed group consensus model, a consensus-based solution to the MAGDM problems with IBDs and IDPRs is generated. Finally, the proposed model is applied to a sustainable supplier selection problem of automobile enterprise in Wuhu, Anhui Province, China to demonstrate its correctness and effectiveness.","","2026-01-27 18:56:21","2026-01-27 18:56:21","","","","","","","","","","","","","","","","","","","","","","","","","","","","","","","","","","","","","","","","","","","","","","","","","","","","","","","","","","","","","","","","","","","","","","","","",""
"M2ECS956","journalArticle","","","Large-Scale Behavioral Three-Way Group Decision Based on Prospect Theory Under Dual Hesitant Fuzzy Environment","","","","","","Three-way decision (TWD) is a powerful method to tackle complex and high-risk decision-making problems. The proliferation of social networks and rapid exchange of information has fostered growing instances of large-scale group decision-making (LSGDM), which has become an emerging concern because of its necessity and applicability in distinct domains. This necessitates the investigation of LSGDM within the framework of TWD. Given the essential role of the consensus on loss functions in three-way group decision (TWGD) and the significant impact of bounded rationality on decision results, this article, therefore, aims to present a consensus-reaching process (CRP) model for the prospect theory-based utility functions in LSGDM and thus build a novel large scale behavioral TWGD model for solving LSGDM issues under dual hesitant fuzzy (DHF) uncertainty. Specifically, the behavioral DHF TWD based on prospect theory is first built, wherein the threshold parameters are figured out by maximizing expected prospect value, instead of minimizing expected loss. Then, the social network based on social degree considering the co-opetition relationship is constructed, and a social network analysis method is implemented to cluster decision-makers. Accordingly, the CRP model for the prospect value adjustment is designed. Afterward, a large-scale behavioral TWGD model is proposed to tackle an LSGDM issue, resilient supplier selection. Finally, a numerical example and comparative analysis are conducted to demonstrate the effectiveness of the proposed model.","","2026-01-27 18:56:21","2026-01-27 18:56:21","","","","","","","","","","","","","","","","","","","","","","","","","","","","","","","","","","","","","","","","","","","","","","","","","","","","","","","","","","","","","","","","","","","","","","","","",""
"VS435RDI","journalArticle","","","Decision framework of group consensus with hesitant fuzzy linguistic preference relations","","","","","","Group decision making typically requires eliciting and coordinating the preferences of group members. In this study, the authors develop an overall framework of group consensus in context of hesitant fuzzy linguistic preference relations (HFLPRs). A new notion of distance measure between two HFLPRs is defined, based on which a consensual framework consists of two mechanisms, the automatic consensus reaching and the interactive consensus reaching is presented. Accordingly, they, respectively, design two algorithms to implement these mechanisms. Finally, a group decision problem of green supplier selection is provided to exemplify and verify both of the proposed methods, and a comparative analysis with some related approaches is performed.","","2026-01-27 18:56:21","2026-01-27 18:56:21","","","","","","","","","","","","","","","","","","","","","","","","","","","","","","","","","","","","","","","","","","","","","","","","","","","","","","","","","","","","","","","","","","","","","","","","",""
"7QXCGDJ8","journalArticle","","","Limited budget-based consensus model for large group decision making with hesitant fuzzy linguistic information","","","","","","Considering the uncertainty of large group decision-making and the limitation of resources, this paper constructs a large group decision-making method with hesitant fuzzy linguistic term set (HFLTS) based on limited budget. Firstly, by studying the basic theory of HFLTS, a weighted aggregation model of HFLTS is proposed, which can ensure the minimum weighted distance between aggregated HFLTS and HFLTSs before aggregation. Secondly, a decision makers' weight determination algorithm is proposed by considering the quality of trust sources in the social trust network, which is calculated by the LeaderRank centrality measure. Furthermore, a maximum group consensus level model (MGCM) based on limited budget is constructed, in which the adjustment cost of decision makers is determined by the hesitancy degree in the evaluation and trust out-degree. For the situation of insufficient budget, the order correlation between the alternatives' ranking before and after the budget increase is introduced to judge whether to increase the budget to achieve a higher group consensus level. Then, a limited budget-based large group decision-making method with hesitant fuzzy linguistic information is proposed. And this method is applied to the selection of equipment suppliers for hydrogen refueling station. Finally, the effectiveness of the proposed method is verified by comparison with existing research methods and sensitivity analysis.","","2026-01-27 18:56:20","2026-01-27 18:56:20","","","","","","","","","","","","","","","","","","","","","","","","","","","","","","","","","","","","","","","","","","","","","","","","","","","","","","","","","","","","","","","","","","","","","","","","",""
"XXIHFSEJ","journalArticle","","","A decentralized feedback mechanism with compromise behavior for large-scale group consensus reaching process with application in smart logistics supplier selection","","","","","","This paper proposes a decentralized feedback mechanism to help large-scale decision makers (DMs) reach consensus considering the limited compromise behavior of subgroups. First, a novel decentralized opinion interaction mechanism is designed to identify the most inconsistent subgroups pair in the group and make them interact with each other. Then it is different from the centralized interaction mechanism, which adopts the aggregation of the opinions of other subgroups. The former is suitable for situations with low initial consensus level while the later is for high consensus level. Secondly, the compromise behavior of subgroups in the feedback process is explored, and then the concept of `compromise threshold' (CT) is defined to analyze the limited compromise behavior of subgroups. Finally, an illustrative example regarding the smart logistics supplier selection (SLEC) is described to demonstrate the effectiveness and advantages of the proposed mechanism.","","2026-01-27 18:56:20","2026-01-27 18:56:20","","","","","","","","","","","","","","","","","","","","","","","","","","","","","","","","","","","","","","","","","","","","","","","","","","","","","","","","","","","","","","","","","","","","","","","","",""
"7ZMG32T2","journalArticle","","","Personalized trust incentive mechanisms with personality characteristics for minimum cost consensus in group decision making","","","","","","Traditional group decision making is usually to force inconsistent decision-makers (Namely, decision makers whose consensus degree does not reach a predefined level/consensus threshold.) to revise their opinions in order to improve the group consensus level. But decision-makers with conservative, neutral and radical behaviors differ in the extent to which they adjust their opinions. Hence, this paper investigates a personalized trust incentive mechanisms with personality characteristics for minimum cost consensus in group decision making, including opinion incentive and trust incentive. Firstly, the trust-driven personalized incentive mechanisms for personality characteristics, such as conservative, neutral and radical, are established to improve the adoption intention of decision makers. And then, the trust incentive evolution model with personality characteristics is established to reveal that the trust held by the remaining group members towards conservative decision makers is stable, the trust towards neutral decision makers is enhanced, and the trust towards radical decision makers is weakened. Further, the minimum cost consensus model based on personalized trust incentive mechanism with personality characteristics is constructed to generate feedback opinions of these decision makers within their respective adjustment ranges, exploring the influence law of consensus efficiency in decision makers with different personality characteristics. Finally, an illustrative example on supplier selection in the cruise ship manufacturing industry is provided to demonstrate the rationality and superiority of the proposed method.","","2026-01-27 18:56:20","2026-01-27 18:56:20","","","","","","","","","","","","","","","","","","","","","","","","","","","","","","","","","","","","","","","","","","","","","","","","","","","","","","","","","","","","","","","","","","","","","","","","",""
"Q4VYBM9E","journalArticle","","","A consensus model for hesitant fuzzy linguistic group decision-making in the framework of Dempster-Shafer evidence theory","","","","","","In group decision-making (GDM), a consensus building process (CRP) is necessary to improve the level of consensus within the group. This paper develops a new CRP model for GDM problems with hesitant fuzzy linguistic term sets (HFLTSs), which also considers the reliability of experts. Firstly, we present the calculation of expert reliability by measuring the hesitancy degree and similarity degree, simultaneously. Next, we propose an approach to generate group opinions based on the reliability of experts within the framework of the Dempster-Shafer evidence theory (DSET). In this way, the original individual opinions can be retained well and the discourse power of experts with higher reliability but lower weights can be strengthened. Further, the reliability is introduced to build a new feedback mechanism that provides experts with explicit advice during the consensus reaching process. Subsequently, a new CRP algorithm for hesitant fuzzy linguistic GDM (HFLGDM) problems is proposed to help the group achieve consensus. A practical case study is utilized to illustrate the application of the proposed algorithm. Finally, we conduct a comparison experiment to verify the advantages of the proposed CRP algorithm. (C) 2020 Elsevier B.V. All rights reserved.","","2026-01-27 18:56:20","2026-01-27 18:56:20","","","","","","","","","","","","","","","","","","","","","","","","","","","","","","","","","","","","","","","","","","","","","","","","","","","","","","","","","","","","","","","","","","","","","","","","",""
"BNKBAFBI","journalArticle","","","A maximum satisfaction-based feedback mechanism for non-cooperative behavior management with agreeableness personality traits detection in group decision making","","","","","","Non-cooperative behaviors will lead to consensus failure in group decision making problems. Asa result, managing non-cooperative behavior is a significant challenge in group consensus reaching processes, which involves two main research questions:(1) How to define non-cooperative behavior? (2) How to design an appropriate model to manage non-cooperative behavior? Existing studies often overlook the psychological motivations behind non-cooperative behavior and achieve group consensus potentially at the expense of decision-makers' satisfaction. To address these issues, this study proposes a novel maximum satisfaction-based feedback mechanism for managing non-cooperative behavior with personality traits prediction. To address the first research question, a novel approach for identifying non-cooperative behavior is proposed by comparing the solution of the Minimum Adjustment Consensus Model (MACM) to the maximum acceptable adjustment. The latter is defined by the decision maker's Agreeableness trait within the Big Five personality traits framework, which is predicted by a CNN-BiLSTM model using the decision maker's online reviews. For addressing the second research question, a novel two-phases feedback mechanism is introduced to manage non-cooperative behaviors based on the satisfaction principle in decision-making. The first phase involves implementing adjustment rule for non-cooperative decision-makers. The second phase involves applying adjustment rule for cooperative decision-makers. Finally, this study presents a case study focusing on the selection of a new energy vehicle enterprise supplier to illustrate the effectiveness of the proposed model in real-world applications. Furthermore, sensitivity analysis and comparative assessments are conducted to demonstrate advantages over traditional methods. Results indicate that the proposed method enhances both satisfaction and consensus levels compared to conventional non-cooperative consensus-reaching mechanisms.","","2026-01-27 18:56:20","2026-01-27 18:56:20","","","","","","","","","","","","","","","","","","","","","","","","","","","","","","","","","","","","","","","","","","","","","","","","","","","","","","","","","","","","","","","","","","","","","","","","",""
"KAKZLFF4","journalArticle","","","Grey multi-criteria group consensus decision-making based on cobweb model","","","","","","PurposeConsidering the bounded confidence of decision-makers (DMs), a new grey multi-criteria group consensus decision-making (GMCGCDM) model is established by using interval grey number (IGN), cobweb model, social network analysis (SNA) and consensus reaching process (CPR).Design/methodology/approachFirstly, the model analyzes the social relationship of DM under social networks and proposes a calculation method for DMs' weights based on SNA. Secondly, the model defines a cobweb model to consider the preferences of decision-making alternatives in the decision-making process. The consensus degree is calculated by the area surrounded by the connections between each index value of DMs and the group. Then, the model coordinates the different opinions of various DMs to reduce the degree of bias of each DM and designs a consensus feedback mechanism based on bounded confidence to guide DMs to reach consensus.FindingsThe advantage of the proposed method is to highlight the practical application, taking the selection of low-carbon suppliers in the context of dual carbon as an example. Comparison analysis is performed to reveal the interpretability and applicability of the method.Originality/valueThe main contribution of this paper is to propose a new GMCGCDM model, which can not only expand the calculation method of DM's weight and consensus degree but also reduce the time and cost of decision-making.","","2026-01-27 18:56:20","2026-01-27 18:56:20","","","","","","","","","","","","","","","","","","","","","","","","","","","","","","","","","","","","","","","","","","","","","","","","","","","","","","","","","","","","","","","","","","","","","","","","",""
"EWA7E8AB","journalArticle","","","Modeling consistency and consensus in social network group decision making: The role of limited dual tolerance and compromise behaviors","","","","","","In interactive social network group decision making (SNGDM), decision-makers frequently consider both their own preferences and the preferences of trusted members when adjusting preferences. This dual consideration results in the formation of limited dual tolerance and compromise behaviors, as reflected in the cost and willingness of decision-makers to adjust their preferences. This paper investigates the role of limited dual tolerance and compromise behaviors in the consistency and consensus management in SNGDM with additive preference relations. First, this paper introduces the concepts of limited dual tolerance and compromise behaviors. Then, this paper presents an optimization-based model, tailored to manage consistency and consensus in the interactive SNGDM. This model takes into account the two behaviors mentioned, with the goal of assisting decision-makers in adjusting their preferences to achieve consistency and consensus while minimizing associated costs. Given that limited dual compromise behavior may impede decision-makers from achieving consistency and consensus, this paper designs a model to help decision-makers adjust their dual compromise values. Further, this paper develops an interactive consistency and consensus management process with limited dual tolerance and compromise behaviors. Finally, an illustrative example involving sustainable supplier selection is applied, along with the simulation analysis and a discussion, to validate the effectiveness of the proposed framework.","","2026-01-27 18:56:20","2026-01-27 18:56:20","","","","","","","","","","","","","","","","","","","","","","","","","","","","","","","","","","","","","","","","","","","","","","","","","","","","","","","","","","","","","","","","","","","","","","","","",""
"B6UFBVVX","journalArticle","","","An Incentive Mechanism-Based Minimum Adjustment Consensus Model Under Dynamic Trust Relationship","","","","","","In traditional group decision making, the inconsistent experts are usually forced to make compromises toward the group opinion to increase the group consensus level. However, the strategy of reaching group consensus via an incentive mechanism encouraging adjustment of preferences is more effective than forcing, which is the aim of this article. Specifically, this article establishes a novel incentive mechanism to support group consensus under dynamic trust relationship. First, the supremum and infimum incentives-based rule driven by trust relationship is defined. Based on the assumption that if incentive conditions are met, then experts will be willing to adjust their preferences, the incentive behavior-driven minimum adjustment consensus model is developed to generate optimal incentive-based recommendation preferences. Thus, the proposed incentive mechanism can effectively reduce the preference adjustment cost and promote group consensus reaching. Third, the updated trust relationships between experts are shown to be strengthen by the proposed incentive-driven preference revision. Consequently, the optimization model based on trust interaction relationship is constructed to obtain the final group preference matrix. Finally, a supplier selection case of high-end medical equipment is provided to illustrate the proposed method and show the rationality and advantages of the proposed methodology with both a sensitivity analysis and a comparison analysis.","","2026-01-27 18:56:20","2026-01-27 18:56:20","","","","","","","","","","","","","","","","","","","","","","","","","","","","","","","","","","","","","","","","","","","","","","","","","","","","","","","","","","","","","","","","","","","","","","","","",""
"FAA4X2WY","journalArticle","","","A bargaining game based feedback mechanism to support consensus in dynamic social network group decision making","","","","","","A bargaining game is used to develop feedback mechanism for dynamic social networks group decision making (SN-GDM). The dynamic trust relationships between experts are updated by the change of their consensus state after each round of interaction. Then, a maximum entropy model based on individual interactive relationship and fairness is established to determine the comprehensive weight of each expert, which considers: (1) the individual weight by influence of expert; (2) the interaction weight by social relationships of experts. Hence, 2-tuple linguistic collective evaluation matrix of the 2-additive Choquet integral under Mobius transform is put forward. Further, the equilibrium solution of two experts in the bargaining game is established, and then this equilibrium recommendation will be accepted by both experts. Consequently, a bargaining game based feedback mechanism driven by trust relationship is proposed to reflect the interaction behaviors between the inconsistent expert and her/his most trusted consistent one, and therefore the recommendation advices are generated for them to promote consensus in SN-GDM. Finally, a sustainable supplier selection example demonstrates the effectiveness of the proposed approach.","","2026-01-27 18:56:19","2026-01-27 18:56:19","","","","","","","","","","","","","","","","","","","","","","","","","","","","","","","","","","","","","","","","","","","","","","","","","","","","","","","","","","","","","","","","","","","","","","","","",""
